[
  {
    "claim_id": "CLM-001",
    "claim_text": "Live MCA V3 Connector • MCA Verified",
    "category": "GOVERNMENT_CONNECTIVITY",
    "risk_priority": "P2_HIGH",
    "service_id": null,
    "vertical_id": null,
    "jurisdiction": "IN-CENTRAL",
    "source_id": "SRC-MCA-001",
    "statutory_provision": "Section 398 of Companies Act, 2013 (Electronic form submission and MCA V3 portal architecture)",
    "source_excerpt": "The Ministry of Corporate Affairs operates the MCA21 portal for electronic filing; no direct third-party programmatic write API is exposed to non-authorized commercial entities.",
    "effective_from": "2022-01-01",
    "effective_to": null,
    "checked_date": null,
    "verification_status": "REJECTED_OR_OUTDATED",
    "requires_professional_review": true,
    "professional_review_outcome": "REJECTED",
    "last_reviewed_at": "2026-10-17",
    "disposition": "CORRECTED",
    "unresolved_questions": "None. Remediation confirmed on disk in Phase 1.",
    "notes": "Deceptive live government sync claim removed from portal/dashboard.html. Evaluates to false under production gating.",
    "last_verified_at": null
  },
  {
    "claim_id": "CLM-002",
    "claim_text": "Real-time sync active",
    "category": "REAL_TIME_SYNC",
    "risk_priority": "P2_HIGH",
    "service_id": null,
    "vertical_id": null,
    "jurisdiction": "IN-CENTRAL",
    "source_id": "SRC-MCA-001",
    "statutory_provision": null,
    "source_excerpt": "No WebSocket, SSE, or background polling daemon configured in repository.",
    "effective_from": null,
    "effective_to": null,
    "checked_date": null,
    "verification_status": "REJECTED_OR_OUTDATED",
    "requires_professional_review": true,
    "professional_review_outcome": "REJECTED",
    "last_reviewed_at": "2026-10-17",
    "disposition": "CORRECTED",
    "unresolved_questions": "None. Remediation confirmed on disk in Phase 1.",
    "notes": "Replaced with 'Rules-Based Engine Active' in Phase 1.",
    "last_verified_at": null
  },
  {
    "claim_id": "CLM-003",
    "claim_text": "Live Regulatory OS • Real-Time CIN/LLPIN Sync",
    "category": "REGULATORY_OS",
    "risk_priority": "P2_HIGH",
    "service_id": null,
    "vertical_id": null,
    "jurisdiction": "IN-CENTRAL",
    "source_id": "SRC-MCA-001",
    "statutory_provision": null,
    "source_excerpt": "No direct database synchronization configured with MCA master data records.",
    "effective_from": null,
    "effective_to": null,
    "checked_date": null,
    "verification_status": "REJECTED_OR_OUTDATED",
    "requires_professional_review": true,
    "professional_review_outcome": "REJECTED",
    "last_reviewed_at": "2026-10-17",
    "disposition": "CORRECTED",
    "unresolved_questions": "None. Remediation confirmed on disk in Phase 1.",
    "notes": "Replaced with 'Statutory Compliance Platform • Structured Entity Governance' in Phase 1.",
    "last_verified_at": null
  },
  {
    "claim_id": "CLM-004",
    "claim_text": "Real-time statutory countdown clocks",
    "category": "COUNTDOWN_ACCURACY",
    "risk_priority": "P2_HIGH",
    "service_id": null,
    "vertical_id": null,
    "jurisdiction": "IN-CENTRAL",
    "source_id": "SRC-MCA-001",
    "statutory_provision": "Sections 92 & 137 of Companies Act, 2013 (Statutory annual filing due dates)",
    "source_excerpt": "Filing countdown timers rely on client-side Date arithmetic, not real-time registry synchronization.",
    "effective_from": "2014-04-01",
    "effective_to": null,
    "checked_date": null,
    "verification_status": "REJECTED_OR_OUTDATED",
    "requires_professional_review": true,
    "professional_review_outcome": "REJECTED",
    "last_reviewed_at": "2026-10-17",
    "disposition": "CORRECTED",
    "unresolved_questions": "None. Replaced with statutory calendar notices.",
    "notes": "Countdown claim corrected in 404.html and portal pages.",
    "last_verified_at": null
  },
  {
    "claim_id": "CLM-005",
    "claim_text": "Scanning IP India public records...",
    "category": "GOVERNMENT_CONNECTIVITY",
    "risk_priority": "P1_CRITICAL",
    "service_id": "V06-SVC-003",
    "vertical_id": "V06",
    "jurisdiction": "IN-CENTRAL",
    "source_id": "SRC-CGPDTM-001",
    "statutory_provision": "Trade Marks Act, 1999 Section 148 read with Trade Marks Rules, 2017 Rule 123 (Inspection of public registers)",
    "source_excerpt": "Public search of trademarks is hosted at ipindiaonline.gov.in; client-side JS performed no HTTP fetch to IP India.",
    "effective_from": "2017-03-06",
    "effective_to": null,
    "checked_date": null,
    "verification_status": "REJECTED_OR_OUTDATED",
    "requires_professional_review": true,
    "professional_review_outcome": "REJECTED",
    "last_reviewed_at": "2026-10-17",
    "disposition": "CORRECTED",
    "unresolved_questions": "None. Fake progress animation removed in Phase 1.",
    "notes": "Removed simulated progress message; replaced with transparent pre-search advisory.",
    "last_verified_at": null
  },
  {
    "claim_id": "CLM-006",
    "claim_text": "No identical prior registrations found in Class 42",
    "category": "TRADEMARK_AVAILABILITY",
    "risk_priority": "P1_CRITICAL",
    "service_id": "V06-SVC-003",
    "vertical_id": "V06",
    "jurisdiction": "IN-CENTRAL",
    "source_id": "SRC-CGPDTM-001",
    "statutory_provision": "Trade Marks Act, 1999 Section 11 (Relative grounds for refusal of registration)",
    "source_excerpt": "A trade mark shall not be registered if because of its identity with an earlier trade mark and similarity of goods or services there exists a likelihood of confusion.",
    "effective_from": "2003-09-15",
    "effective_to": null,
    "checked_date": null,
    "verification_status": "REJECTED_OR_OUTDATED",
    "requires_professional_review": true,
    "professional_review_outcome": "REJECTED",
    "last_reviewed_at": "2026-10-17",
    "disposition": "CORRECTED",
    "unresolved_questions": "None. Fabricated clearance verdict eliminated.",
    "notes": "Removed fabricated availability verdict; added prominent disclaimer directing users to official IP India portal.",
    "last_verified_at": null
  },
  {
    "claim_id": "CLM-007",
    "claim_text": "High availability probability • Proceed to filing",
    "category": "TRADEMARK_AVAILABILITY",
    "risk_priority": "P1_CRITICAL",
    "service_id": "V06-SVC-003",
    "vertical_id": "V06",
    "jurisdiction": "IN-CENTRAL",
    "source_id": "SRC-CGPDTM-001",
    "statutory_provision": "Trade Marks Act, 1999 Sections 9 & 11",
    "source_excerpt": "Absolute and relative grounds for refusal require comprehensive attorney clearance search across all 45 classes.",
    "effective_from": "2003-09-15",
    "effective_to": null,
    "checked_date": null,
    "verification_status": "REJECTED_OR_OUTDATED",
    "requires_professional_review": true,
    "professional_review_outcome": "REJECTED",
    "last_reviewed_at": "2026-10-17",
    "disposition": "CORRECTED",
    "unresolved_questions": "None. Misleading advice removed.",
    "notes": "Removed filing-readiness directive; replaced with guidance on formal attorney clearance review.",
    "last_verified_at": null
  },
  {
    "claim_id": "CLM-008",
    "claim_text": "NCLT Merger & Restructuring Petition Execution",
    "category": "TRIBUNAL_ADVOCACY_SCOPE",
    "risk_priority": "P1_CRITICAL",
    "service_id": "V09-SVC-003",
    "vertical_id": "V09",
    "jurisdiction": "IN-CENTRAL",
    "source_id": "SRC-BAR-001",
    "statutory_provision": "Companies Act, 2013 Sections 230-232 read with Advocates Act, 1961 Section 30",
    "source_excerpt": "Section 30 of Advocates Act 1961 guarantees advocates the right to practice before all courts and tribunals.",
    "effective_from": "2016-12-15",
    "effective_to": null,
    "checked_date": null,
    "verification_status": "REJECTED_OR_OUTDATED",
    "requires_professional_review": true,
    "professional_review_outcome": "REJECTED",
    "last_reviewed_at": "2026-10-17",
    "disposition": "CORRECTED",
    "unresolved_questions": "Advocacy vs transactional secretarial scheme support boundaries before NCLT.",
    "notes": "Retitled to 'NCLT Merger Scheme Secretarial Execution (V09-SVC-003)'; restricted strictly to Sections 230-232 secretarial support.",
    "last_verified_at": null
  },
  {
    "claim_id": "CLM-009",
    "claim_text": "Full Tribunal Advocacy & NCLT Representation",
    "category": "TRIBUNAL_ADVOCACY_SCOPE",
    "risk_priority": "P1_CRITICAL",
    "service_id": "V09-SVC-003",
    "vertical_id": "V09",
    "jurisdiction": "IN-CENTRAL",
    "source_id": "SRC-BAR-001",
    "statutory_provision": "Advocates Act, 1961 Sections 29, 30 & 33",
    "source_excerpt": "Section 33: Except as otherwise provided in this Act or in any other law for the time being in force, no person shall, on or after the appointed day, be entitled to practise in any court or before any authority or person unless he is enrolled as an advocate under this Act.",
    "effective_from": "1961-05-19",
    "effective_to": null,
    "checked_date": null,
    "verification_status": "REJECTED_OR_OUTDATED",
    "requires_professional_review": true,
    "professional_review_outcome": "REJECTED",
    "last_reviewed_at": "2026-10-17",
    "disposition": "CORRECTED",
    "unresolved_questions": "Commercial representation before NCLT benches requires independent enrolled advocate under Advocates Act 1961.",
    "notes": "Removed contentious advocacy scope; restricted to non-contentious secretarial scheme filings.",
    "last_verified_at": null
  },
  {
    "claim_id": "CLM-010",
    "claim_text": "Insolvency Defense Commercial Retainer Packages",
    "category": "TRIBUNAL_ADVOCACY_SCOPE",
    "risk_priority": "P1_CRITICAL",
    "service_id": null,
    "vertical_id": "V10",
    "jurisdiction": "IN-CENTRAL",
    "source_id": "SRC-BAR-001",
    "statutory_provision": "Insolvency and Bankruptcy Code, 2016 Sections 7, 9 & 10 read with Advocates Act, 1961 Section 30",